Team Name,Series Number,Filename,Name,Description,Gender,Attributes,UUID,Hash
1,adewale-the-amebo,adewale the amebo,Adewale likes to be in everyone's business. ,Male,hair: bald; eyes: black; teeth: none; clothing: red; accessories: mask; expression: none; strength: powerful; weakness: curiosity,cad316c3-37f8-4b27-9f53-9d803bfcfee7,441d73577b1058927db6f17d326e0c809927cf887b6b8b5131c068386fe76c4e
2,alli-the-queeny,alli the queeny,Alli is an LGBT Stan.,Male,hair: bald; eyes: white; teeth: none; clothing: yellow; accessories: mask; expression: none; strength: powerful; weakness: none,a57ecda4-a26f-4e97-a757-e1800af39aab,4def58d3b2cc502e479b562fdfdb138947bf3467fe85656a9af361c71e0dfac8
3,aminat-the-snnobish,aminat the snnobish,Aminat never really wants to talk to anyone.,Female,hair: brown bun; eyes: none; teeth: none; clothing: yellow; accessories: glasses; expression: blank; strength: none; weakness: attitude,0e37ed0d-3e84-4f32-a91f-ec9c4ba8c7de,ba04fd6835bcf3d91f76b10abd8d0b3b08687f11e5be0162c3de0ff9c5d6c2af
4,aminu-the-carpenter,aminu the carpenter,Aminu's hands are blessed; he makes the best furniture in the whole of Kano.,Male,hair: bald; eyes: blue; teeth: none; clothing: yellow; accessories: mask; expression: none; strength: powerful; weakness: none,4f30b751-96e7-40fe-97fd-e3d44973ff2f,9a4661403925cc9a92656fd86498bfce413d809c5e4aa9bb11f90788c568b0ba
5,chibuike-the-kudibag,chibuike the kudibag,Chibuike is too rich. Everyone wonders how he got it.,Male,hair: bald; eyes: black; teeth: none; clothing: blue; accessories: mask; expression: none; strength: hustler; weakness: none,5ce854f2-7ac1-46fd-b3fe-57583935d1e5,9d32b84fbc95372ffcf565fe18f4ee4a5f17b72ac404452188de49f28b3237ef
6,chidinma-the-model,chidinma the model,From Paris' runways; to London's streets; she's always in demand.,Female,hair: brown hair; eyes: none; teeth: none; clothing: multicolored; accessories: glasses; expression: none; strength: hardworking; weakness: none,c98db72e-49ac-4ca6-89d5-e00f5fbbcc45,c77fb1c46c4b5a68c8979ca9ac381d39822f58f3da94b7ade204169b00ff70c9
7,chioma-pretty- girl,chioma pretty girl,Chioma's face card is a 100.,Female,hair: dreads; eyes: none; teeth: none; clothing: multicolored; accessories: glasses; expression: none; strength: none; weakness: none,182ea888-a85b-42ca-ad73-ed4f8f9aa5c7,204782f8eb5a7aad6b4ad1c103bbb45a7c3e9fbf792d9fd1a730dc86ceab1b71
8,damilare-the-handsome,damilare the handsome,He's a fine boy; proper eye candy. ,Male,hair: bald; eyes: white; teeth: none; clothing: yellow; accessories: mask; expression: none; strength: none; weakness: none,27eca2dc-d7df-474a-8f8f-1858152c711e,a3f09269f397293d54e9bc4a0257f21350575526fa85c3165257da4374e8153f
9,ebiowie-the-planter,ebiowie the planter,Ebiowei has a reputation for nurturing plants.,Male,hair: bald; eyes: none; teeth: none; clothing: multicolored; accessories: none; expression: none; strength: powerful; weakness: none,f1df8270-4d60-4bd4-8959-ba7c384db5c4,6e37cfe413e551c0c86e958afdbe92be8dea66f9f9f3899a2c8e316fe6c19369
10,emeka-the-businessman,emeka the businessman,Emeka only cares about containers. No time to waste.,Male,hair: bald; eyes: white; teeth: none; clothing: orange; accessories: mask; expression: none; strength: hard worker; weakness: none,9b3d75da-4887-4089-aee4-50de3954fdc9,58ac7cbc0890b8b967e143a736acd6bf2c5477b7522258a306a166c3da871f73
11,gbeminyi-the-monk,gbeminyi the monk,He lives in a monastery off the coast. No one has heard him speak in years.,Male,hair: bald; eyes: blue; teeth: none; clothing: yellow; accessories: mask; expression: none; strength: none; weakness: none,c8b1fd1d-8551-4bb4-8dc4-923a9aeb39fb,b32d824df974d28479792f96286b5fee63befb27c930a26fa84b119632614da1
12,henry-the-sportsman,henry the sportsman,He's played every sport known to man. Even cricket.,Male,hair: bald; eyes: yellow; teeth: none; clothing: multicolored; accessories: mask; expression: none; strength: agility; weakness: none,e1225451-bfdf-4a1f-8d37-9cce3a0bd67b,ec0f0202a0f25efeecfccee650c43515dfbd7080659415a454a1718ada4862ac
13,mayowa-the-smallie,mayowa the smallie,Mayowa is so small but everyone loves him still.,Male,hair: bald; eyes: blue; teeth: none; clothing: multicolored; accessories: mask; expression: none; strength: none; weakness: none,dfbb4163-df24-4d54-b74c-6218a68df8bd,689be1f5a7913931ec7d141d86f90f24542f67e58c888d12f23349821a9a8351
14,muyiwa-the-stylish,muyiwa the stylish,Muyiwa has a motto which is never to be caught unfresh.,Male,hair: bald; eyes: ash; teeth: none; clothing: multicolored; accessories: mask; expression: none; strength: creativity; weakness: none,dcf9d5a0-57b7-4126-a05e-6c8f1045d3f7,89076f1ddcd67005b786618724543445658dabd5d730c40c4d013eefb4cbdc1b
15,nina-paper-chaser,nina paper chaser,Nina loves money. It's all she dreams of. ,Female,hair: brown double bun; eyes: none; teeth: none; clothing: animal print; accessories: glasses; expression: none; strength: hustler; weakness: none,59524227-dc52-407c-8cca-e9e8c5fb3018,37403172162ebde98ca8e0bdf185f466e3c5e3099b4bfbb7a01051f8f5ee1e16
16,oluwaseun-spicy,oluwaseun spicy,He loves spicy foods. He cooks pepper and sprinkles rice on top.,Male,hair: bald; eyes: black; teeth: none; clothing: yellow and purple agbada; accessories: mask; expression: none strength: none; weakness: none,808f7007-6552-4efa-bd13-4b7c337b102b,e47572371dcb60f3ac76e37714dcca4477dc1a25a12c9048a0307d811c201956
17,sesan-the-smartie,sesan the smartie,Sesan always comes first in competitions.,Male,hair: bald; eyes: blue; teeth: none; clothing: orange; accessories: mask; expression: none; strength: intelligence; weakness: none,ba3edda7-8940-4ca4-97ba-826398d5909f,fbd9052b9c0195cfdfe744657cca58aac3ebccc346d744b8d70d180eb67f79ba
18,tiwa-london,tiwa london,If she says she's in London and you see her; you're in London too.,Female,hair: braids; eyes: none; teeth: none; clothing: black top; accessories: glasses; expression: none; strength: none; weakness: untruthfulness;,78da7aeb-8352-4e25-89ac-dc48b5984089,fe336c6492fb1089760527409754c3c0f615ae56cf324f17c544bbc506463c7e
19,tunde-yoruba-demon,tunde yoruba demon,Tunde derives joy in breaking hearts. It's a lifestyle.,Male,hair: bald; eyes: white; teeth: none; clothing: purple and yellow agbada; accessories: mask; expression: none; strength: none; weakness: promiscuity,53b46bd7-a537-402b-b249-0b4074a8faae,71853024009032370cd6fcbc53065fb597a016be0e0be08d8e8a542fd914fae1
20,yakubu-the-zombie,yakubu the zombie,Yakubu earned his zombie title because na only dust full him head.,Male,hair: bald; eyes: black; teeth: none; clothing: green and purple agbada; accessories: mask; expression: none; strength: none; weakness: slow to understand things,4adb6781-1614-424e-8f77-fe59ffca2209,ef837dd4f255497f3003b18c21f5037a18563efc4d2a9c8381cdd803598b4005
21,abdul-the-vibe,abdul the vibe,Abdul the life of the party and can never be caught un-fresh.,Male,hair: none; eyes: black; teeth: none; clothing: purple and yellow kaftan; accessories: cap; expression: happy; strength: strong; weakness: no limitation,770f817a-9d9a-4772-9a91-e66dd9d03470,1a26d52c1a54bd56a638279eae4846a1f67236653bd815d98522fd74d6d4e847
22,emeka-the -clown,emeka the clown,Emeka the funny man; always making silly joke.,Male,hair: none; eyes: black; teeth: none; clothing: yellow and black ankara; accessories: cap; expression: straight face; strength: funny; weakness: little physique,78810fa6-a7ef-4d83-bf57-caf49db4ee69,9a475cbeb225b0d0d0ba6fdc664c96a86b77fddf5e71a182274c26aa44c03341
23,salam-the-odogwu,salam the odogwu,Salam is a big time textile marketer always sourcing for quality materials.,Male,hair: none; eyes: brown; teeth: none; clothing: wine and yellow; accessories: yayada cap; expression: happy; strength: influence; weakness: impatience,f2957ded-022c-4b07-92c6-b345d4816a67,05674c78e01958dcde914183b6944a486b788b4ce01cdfc0b2f75af9c54f8871
24,charles-the-exporter,charles the exporter,Charles a business man an importer and exporter never to be caught idle.,Male,hair: none; eyes: grey; teeth: none; clothing: orange and blue; accessories: okpu ozo cap; expression: happy; strength: influential; weakness: incessant,09395e76-19ed-4852-8748-795ee7496a8e,5e7a286aaeb5b8909a2f50275be335f8d3aa624071d8f3bd4a7f5dc22fb1da26
25,wole-the-pimp,wole the pimp,Wole knows people and his way around his city.,Male,hair: none; eyes: black; teeth: two white teeth with diastema; clothing :yellow dashiki; accessories: yori yori; expression: happy; strength: strong; weakness: promiscuous,4d94d4f7-9b69-4e43-9db1-1fe83df92857,cd9fc26c6d7adea74a38c756f9574276ca8a279f426f3629a658caf887c12fb9
26,saro-the-baller,saro the baller,Saro is a baller and he is always ready to turn-up,Male,hair: orange afro; eyes: blue; teeth: two white teeth with diastema; clothing: black and yellow kente; accessories: none; expression: angry; strength: strong; weakness: insatiable,d35a7514-8996-42fb-a5f2-5a603ec679c5,eb0e89006e6d87e80fa04832049e2f9ff7c435bc1cf65c6006633d76b6bd2b7d
27,ade-omo-yoruba,ade omo yoruba,Ade is an influential man and he is revered in his town.,Male,hair: none; eyes: blue; teeth: complete white teeth and a gold tooth; clothing: black and yellow kente; accessories: wine cap; expression:happy; strength: hardworking; weakness: procrastination,92984fa0-310b-4377-8a10-15965d044383,605e755815de8c6cc3c66699fb531a35a243b84c22eb8d6dc81bf94b1c75ba06
28,shola-cool-kid,shola cool kid,Shola prefers to be alone because he hates stress.,Male,hair: none; eyes: none; teeth: none; clothing: yellow t-shirt and blue dongaris; accessories: red facecap; expression: playful; strength: fun; weakness: playful,3ac5c186-bc14-4eb6-8567-cc818465a64f,cb7f7a282c1b9f5010a556061c50f867943c8663aaa9751980b567d2656a1094
29,charlie-the-smoker,charlie the smoker,Charlie uses smoking as a coping mechanism.,Male,hair: none; eyes: black; teeth: none; clothing: black shirt with lion prints; accessories: blue cap; expression: happy; strength: nice; weakness: gullible,71a0aa22-d111-43b7-8484-43d87310bc42,808188471b6bf810c8aee6066fa5b58cefcc833fb94541bbf445133d41ad4d31
30,femi-the-badguy,femi the badguy,Femi is one of the fliest guys in Lagos.,Male,hair: orange; eyes: black; teeth: none; clothing: white t-shirt and blue dongaris; accessories: smoking pipe; expression: unbothered; strength: fearless; weakness: intolerance,e493e3fb-a8a0-455a-854f-0f6474bbc69f,6938e3e700ca68f77efaf6586c28304db3d12742ae1f45c76b058223a4ef55bf
31,sinzu-money,sinzu money,Sinzu loves spending money on flashy things.,Male,hair: none; eyes: blue; teeth: white complete teeth and a brown tooth; clothing: purple and yellow kaftan; accessories: green-stripped fila cap; expression: strength; strength: generous; weakness: aggressive ,942f8347-9932-4331-bd15-d0f3a048b54f,c6e1e8140393cd942468bc27972427c6ea7871a6af98157597e61381aae78fd7
32,obinna-the-palmwine tapper,obinna the palmwine tapper,Obinna taps palmwine for a living.,Male,hair: none; eyes: black; teeth: none; clothing: yellow black and a touch of pink ankara; accessories: cap; expression: happy; strength: contentment; weakness: naive,0f1af056-2548-4407-bed4-abc11deae05d,cad17ad0032a6ddc3532f788268d4919c912b2dbebb2175389b935afa17e7b78
33,aminu-maikudi,aminu maikudi,Aminu is a wealthy man from a family with generational wealth. ,Male,hair: none; eyes: black; teeth: none; clothing: maroon and yellow agbada; accessories: cap; expression: unbothered; strength: confidence; weakness: selfishness,0129e7a5-e3d0-4675-92d0-1a1e55d11612,19dfdabc5783f29bb00c865a9a13d3aebeacc19d991f8762dec47782561c22d6
34,sabinus-the-town crier,sabinus the town crier,Sabinus delivers messages to his town people.,Male,hair: none; eyes: black; teeth: two white teeth with diastema; clothing: orange ankara with touches of blue; accessories: cap; expression: happy; strength: dexterity; weakness: impatience,01d4ce96-818e-44b1-8813-68a7d34b35ba,984aa9f74ca4967e96c211eec54f6c16daa170db4a5d730ac23d1ea5a9daac99
35,adisa-ibadan,adisa ibadan,Adisa is an elegant man and he is adored by his people.,Male,hair: none; eyes: black; teeth: none; clothing: kente; accessories:abeti-aja cap; expression: mischievous; strength: independent; weakness: bossy,3a925f27-35f6-4dbf-9960-c6527fae5f3e,3abbf798f82c1ff6bc212a0d4ed122ced5d7f2c9cbfd8bf2bef160b9df19761c
36,linda-the-navigator,linda the navigator,Linda knows how to make a way for herself and the people around her.,Female,hair: blonde; eyes: none; teeth: none; clothing:multicolored; accessories: glasses; expression: confused; strength: creative; weakness: insecure,71f335a6-5a4f-4410-9cea-179336f0e498,1c7fc15d189293addd9ce6ed5a53868fa55d13072ba897a511a3b44221a72e28
37,kemi-the-iron lady,kemi the iron lady,Kemi the strongest woman known to the town of Igbede people.,Female,hair: ginger; eyes: none; teeth: none; clothing: ankara; accessories:glasses and a pipe; expression: cool; strength: disciplined; weakness: perfectionist,35b11a31-5b92-49f4-8fb1-30f255d22054,8b15da4c8f27c0e88947275c55def078decf678fb74ea458c418abf4ceef7c0b
38,mercy-the-sassy lady,mercy the sassy lady,Mercy is a confident woman and never hesistate to show it.,Female,hair: brown; eyes: none; teeth:none; clothing: ankara; accessories: glasses; expression: sassy; strenght: creative; weakness: sensitive,7a3c70ac-927f-4a63-a3df-ab86dd27cd0f,775b2a10e98f795083e7420c67a9678367e4fad8e8dd7cb4f998040f1a4e9d85
39,sandra-money,sandra money,Sandra likes getting and spending money.,Female,hair: brown; eyes: none; teeth:none; clothing:yellow and black; accessories: glasses; expression: confused; strength: brave; weakness: overthinker,1bd95fb0-7b2e-4354-bebd-22f9cf70a1ca,3288121d9beacb57ee7fcf9b9e618a657d05c7cf948b8ce923225ab9c9ab7269
40,bimpe-the-fashionista,bimpe the fashionista,Bimpe loves wearing trendy clothes and looking gorgeous.,Female,hair: blonde; eyes: none; teeth:gap teeth; clothing: black cold shoulder shirt; accessories: glasses; expression: shocked; strength: intelligent; weakness: procrastination,92b548b7-998b-46b6-8198-80d407209483,8169c734483c8aeee4648f16357459ed01b3d982182407cbe04237159e8751a2
41,kim-rich-aunty,kim rich aunty,She loves spoiling her nieces and nephew.,Female,hair: pink; eyes: brown; teeth: none; clothing: ankara; accessories: none; expression: smiling; strength:brave; weakness:food,3344a73c-f15e-4afd-a1b2-3199e27eb08f,14d35a3d16c70d9cba589eceeaa7fb3b322f597c7483838f6e3064a58b39eb55
42,barbra-stark,barbra stark,She loves fine dining and spends time with family.,Female,hair: blue; eyes: brown; teeth: none; clothing: ankara; accessories: none; expression: smiling; strength:brave; weakness:food,4f31fd99-4918-42a9-a112-fa60ef36d5c6,f923748d17b282fae514e7afa80c0be575fbdb31f9410e8c6e715e5b95e28e1d
43,jean-art-dolger,jean art dolger,Loves collecting art for charity.,Female,hair: blue; eyes: brown; teeth: none; clothing: ankara; accessories: none; expression: smiling; strength: creative; weakness: food,5e1105d9-e485-462d-a5bf-1eb931976b13,551b879bcfb234c7761b76c705b857f82d70d9092be9c925e4b3c005aa5c0bee
44,flora-burger- eater,flora burger eater,She loves eating burgers.,Female,hair: blue; eyes: brown; teeth: gap; clothing: stripes; accessories: none; expression: frowning; strength: prayerful; weakness: food,054dffd1-cdff-417b-b6c2-a679dabd087b,e80261addd083de212d66d0959ebf7ae8987e5eed2f01d00f39fd55ab14038f2
45,jessie-lord-rings,jessie lord rings,She loves her  (precious) jewelry.,Female,hair: blue; eyes: brown; teeth: none; clothing: satin; accessories: none; expression: smiling; strength: kind; weakness: shy,caacabe1-0abc-43af-92e2-2231248bff93,f2be40083e5d89bc4e015f3433274025e4fb7929eebe2e794d6b894840bbae7b
46,pinky-monky-ponk,pinky monky ponk,She love to dance the honky tonk.,Female,hair: maroon; eyes: blue; teeth: none; clothing: linen; accessories: none; expression: smiling; strength: brave; weakness: chips,bd6a4b38-543e-40fa-9153-f7e1a947ebb1,14fd02f56c8b2030f2190922e7e5701a91ed34e571c49e45a09b8c2953d03eaf
47,wanjiru-hippie-glitter,wanjiru hippie glitter,A hippie that loves her glitters.,Female,hair: blue; eyes: brown; teeth: none; clothing: wool; accessories: none; expression: smiling; strength: none; weakness: babies,683f0d27-3cb4-4948-b1b5-09f10bee575a,65e1248af9c2d8a4215275ed073a54b626bacbb55c57261d26703bde67e4935d
48,njoki-binary-coder,njoki binary coder,She codes with the best language and tops the set.,Female,hair: blue; eyes: brown; teeth: none; clothing: ankara; accessories: none; expression: smiling; strength: none; weakness: none,9b59bdb4-0c6c-4107-9d72-6d38d308edb4,4d97d574a1af27de9a16bcc77e43320f9bbbc9b757430a78adfe8781ee573007
49,wangu-calaba-hustler,wangu calaba hustler,She is a passionate hustler you should be careful with her.,Female,hair: blue; eyes: brown; teeth: none; clothing: ankara; accessories: none; expression: smiling; strength: brave; weakness: flying,67f7da93-3925-4def-b660-58f558c14a19,93f4e3c905fe4fffb159c9bbaa2d4ccdd85720eb422fdf5c49022f976b5c4aaa
50,lulu-dey-kpako,lulu dey kpako,She's is as enthusiastic as she is beautiful.,Female,hair: blue; eyes: brown; teeth: none; clothing: ankara; accessories: none; expression: smiling; strength: loving; weakness: makeup,23b6c38f-ab84-4565-bfe9-d9eb019c9f29,5cd74ece8c960dfddf0ca09faae7c0bf17fda8a105d9a601dc04e450d82622b5
51,kiki-cala-flier,kiki cala flier,She flies first class and gets the best deals.,Female,hair: blue; eyes: brown; teeth: none; clothing: ankara; accessories: none; expression: smiling; strength: brave; weakness: kittens,d24aefff-c9fc-4ea9-a7cf-1b741076c822,ec154e794a166828dcb7a7c9e5d1c9cce9122ee9706bda8f72dbcd9ceb8ab9f4
52,purity-nft -investor,purity nft investor,She is an angel investor looking for the next big thing.,Female,hair: blue; eyes: brown; teeth: none; clothing: ankara; accessories: none; expression: smiling; strength: brave; weakness: clothes,ee86ef77-4793-411a-88d3-ea54d84f6b24,964eb5453b93b171d9a149d9400b49d8fea5cfb1773d531d0bcf6b218b90f841
53,june-binary-monk,june binary monk,She has a twin from Tibet and they always play together .,Female,hair: blue; eyes: brown; teeth: none; clothing: ankara; accessories: none; expression: smiling; strength: brave; weakness: money,102c4cdb-f812-44fd-bf47-5065284c6075,8c9cb4f5ed36bc21540a56abdfe14978f73fd13b808dea3062541b36d8d30ad7
54,aisha-flying-damsel,aisha flying damsel,She is always a damsel in distress and loves to fly.,Female,hair: blue; eyes: brown; teeth: none; clothing: ankara; accessories: none; expression: smiling; strength: brave; weakness: food,c4071af3-b49e-4ad6-898b-7828f90465fb,a08172d1356948e7c34f1172e12239e446cfa930fe46e80d084c41e64b9cc10e
55,bobo-crypto-lovely,bobo crypto lovely,She is a crypto guru you can trust all through.,Female,hair: blue; eyes: brown; teeth: none; clothing: ankara; accessories: none; expression: smiling; strength: brave; weakness: water,427ea0f5-30a3-4d70-a5bd-a6106409b83c,5a95decc9f08e37a495374a573bd21db8e11b59f8a34e74168db91b2812a8089
56,nell-light -embrace,nell light embrace,She is an empathy ready with a kind word or hug.,Female,hair: blue; eyes: brown; teeth: none; clothing: ankara; accessories: none; expression: smiling; strength: brave; weakness: love,9dfe30b4-c71a-471c-8091-f5c4a238eed8,653b6cf11dfa39fd68ed96879d64d8f867d1579eaa418e535e5addf0305b457d
57,rachel-mood-silent,rachel mood silent,Introvert  to the core a mysterious lady.,Female,hair: blue; eyes: brown; teeth: none; clothing: ankara; accessories: none; expression: smiling; strength: brave; weakness: walls,11450acd-f0d7-406f-bc18-bdb680404845,13467c55980c71b86906bd161a77ae6597030950e938934e7b4d752f9ea943cc
58,nana-reflector-agent,nana reflector agent,She loves her chrome fashion style.,Female,hair: pink; eyes: blue; teeth: none; clothing: ankara; accessories:none; expression: smiling; strength: brave; weakness: shy,63bda633-bfca-4b28-823f-7772936b4103,bc1cd8cbf37d953278f2a63a5f524af660f3c3c7ff55dcae5b6c7ef9152a8b13
59,bree-busy-gossip,bree busy gossip,Never whisper your secrets to her except you want the world to know.,Female,hair: blue; eyes:white; teeth: none; clothing: glitter; accessories:none; expression: frowm; strength:goodlistener; weakness:height,4f5898d9-fc99-4053-a56c-b2ec1ef41347,43e23ae3a1a9ce0f819afe9f89575894f19e0975fce5acd459214dfb8e4684e6
60,jude-shadow-fighter,jude shadow fighter,A ninja warrior; the last samurai standing.,Female,hair: white; eyes:brown; teeth: none; clothing: ankara; accessories:chain; expression: smiling; strength:brave; weakness:water,a47b2ed7-d4aa-4404-ac40-0ecea464cf3f,6afef3bcd2176daa2755b703103eb6dc1dc4dcc2622da44e967d8e2addcfc13d
61,toy-soldier,toy soldier,A man stronger than an army.,Male,hair: bald; eyes: closed; teeth: none; clothing: overall; accessories: nose mask; expression: happy; strength: powerful; weakness: sentimental,fc8ea3ac-59d1-11ed-9b6a-0242ac120002,29c37876ca2fe82a7eb868aa156d80980ce8c855dcc766e43ebdf3265807744a
62,pipey-rivers,pipey rivers,A man who loves the water so much and fixes it's path.,Male,hair:bald; eyes: opened; teeth:none; clothing: overall; accessories: nose mask; strength: calculative; weakness: public speaking,58f69cae-59d1-11ed-9b6a-0242ac120002,4e86c1f98d5aad970e8c42f5a9fa60dac8a77636e05d9221084e8ee55dbb149b
63,phiri-of-zambia,phiri of zambia,An african woman with strength and beauty.,Female,hair: purple buns; eyes:nose; teeth: none; clothing: adire; accessories: sunglasses; expression: jiggy; strength: free spirit; weakness: blind ,24b537fa-59d3-11ed-9b6a-0242ac120002,94d4e91e0264ab4562cf92cb728d9eeb350e8afed9119a397e4c208ca5f68449
64,patrick-of-bikinibottom,patrick of bikinibottom,A white man who loves the african culture and associates with their dressing.,Male,hair: bald; eyes: opened; teeth: none; clothing: kente; accessories: nose mask; expression: confused; strength: adaptation; weakness: fluency,064c7b84-59d3-11ed-9b6a-0242ac120002,6ea4ca5544820b89e2ca4d4a04a82b181cfa706d1b74664bf4cc3c08e0fe69c0
65,nobuhle-of-zulu,nobuhle of zulu,A woman; well endowed with beauty.,Female,hair: brown bun; eyes: none; teeth: none; clothing: iqoyi; accessories: sunglasses; expression: astonished; strength: cool headed; weakness: pressure,1ee5b1ce-59d3-11ed-9b6a-0242ac120002,967f21ded7bd08dfb59c4021b9867166ba688c8afd543a7d488b4a5a57f935ab
66,nkosazana-of-xhosa,nkosazana of xhosa,An african princess; always proud of her culture.,Female,hair: ginger afro; eyes:none; teeth: gap teeth; clothing:umbaco; accessories: sunglasses; expression: fufilled; strength: confidence; weakness: endurance,2f1a1724-59d3-11ed-9b6a-0242ac120002,ed1c761cd921e3a25925963e9bc7ec326b0f38a63b6a503a73f9708f0149cf60
67,mandla-of-zulu,mandla of zulu,A simple and introverted guy who keeps to himself.,Male,hair: bald; eyes: opened; teeth: none; clothing: eshowe; accessories: nose mask; expression: irritated; strength: strong willed; weakness: relationship,d04553b2-59d7-11ed-9b6a-0242ac120002,a19c9aa2363c74496d5a620ae2f9aed147ed47d64b9748133f10cc05901892ff
68,john-doe,john doe,A principled guy who is conscious of his health and ensures protection from infection.,Male,hair: bald; eyes: opened; teeth: none; clothing: ankara; accessories: nose mask; expression: cold; strength: cleaniness; weakness: perfectionist,5d19795e-59d2-11ed-9b6a-0242ac120002,04bfa80f55ac9523cf49af3c59c9c66d5bbafdef1edfda5833bb86c7bbebdaa7
69,ghost-of-power,ghost of power,A woman; stronger than ten men combined.,Female,hair: black tied with scalf; eyes: none; teeth: none; clothing: iqoyi; accessories: sunglasses and pipe; espression: ruthless; strength: badass; weakness: cancer,29c764ca-59d3-11ed-9b6a-0242ac120002,c690faa1503b49b7a1b412b7d08d157b93dd9050f91cd0b4e58fe259f65db70b
70,freida,freida,A man who is always peaceful.,Male,hair: bald; eyes: closed; teeth: none; clothing: overall; accessories: nose mask; expression: calm; strength: peaceful; weakness: anger,ee671c4a-59d2-11ed-9b6a-0242ac120002,dcc10611d4c53a4c29ee1c9f49884aaea24a1afcf5b796470e69f62181bca4b1
71,flamboyant-tree,flamboyant tree,A beautiful african woman; billionaire in the making.,Female,hair: one bun dark brown; eyes: none; teeth: none; clothing: kente; accessories: sunglasses; expression: happy; strength: beauty; weakness: lover girl,380e4990-59d3-11ed-9b6a-0242ac120002,3c7ec2e5a696278dc83436065c8786da2710d71736144d03e8d28c14798efcd0
72,david-of-accra,david of accra,A combatant who fights and defends his people,Male,hair: bald; eyes: opened; teeth: none; clothing: kente; accessories: nose mask; expression: angry; strength: super powerful; weakness: sleeping,1c1ef1b4-59d1-11ed-9b6a-0242ac120002,c6caf22791a87e6607f96137123ffbb5e4c25d5c868c81ba08de48502f38bd70
73,cally-lily,cally lily,A man who is a breathe of fresh air.,Male,hair: male; eyes: opened; teeth: none; clothing: overall; accessories: nose mask; expression: confused; strength: calm; weakness: sun,82bba87c-59d1-11ed-9b6a-0242ac120002,f5dd29d8b779b89de5fecc741c719d93463a481947a28df67e6c16c9f1b6f97e
74,bubune-of-accra,bubune of accra,A man with honor; always conscious of his health.,Male,hair: bald; eyes: closed; teeth: none; clothing: kente; accessories: nose mask; expression: happy;  strength: clean; weakness: foodie,faa4b530-59d2-11ed-9b6a-0242ac120002,f860269e46054f1415348facb183cfcd07185a239fe2f5b2c2cf788ee51a7592
75,bediako-of-accra,bediako of accra,A strong man; always ready to fight for what is right.,Male,hair: bald; eyes: opened; teeth: none; clothing: balck with kente; accessories: nose mask; expression: suspicious;  strength: activist; weakness: irrational,fb6e8222-59d0-11ed-9b6a-0242ac120002,0ebc61aa2951057d486cf2405cfb2863094e30a1ec0afdfbdd33ad8673d5c347
76,avatar-aang,avatar aang,A man who is ready to save the world.,Male,hair: bald; eyes: opened; teeth: none; clothing: kaftan; accessories: nose mask; expression: soothing; strength: mind games; weakness: insomia,169f93a0-59d2-11ed-9b6a-0242ac120002,c02422507781cd22133d18f53a316be1258b0cca1a2d77445985bb597a3883c9
