Team Name,Series Number,Filename,Name,Description,Gender,Attributes,UUID,Hash
299,kalu-the-ichie,kalu the ichie,A man of wealth with afluence spreading all over the east,Male,hair: covered; eyes: sky-blue; teeth: white; clothing: orange plain and pattern shirt; accessories: cap; expression: happy; strength: wealth; weakness: pride,482ab247-73a4-4ff8-9172-732f3d0729b8,b224775aa116ffc60bf77a63f0feca4c7baa050a6a76add6090bb72fb1523eae
300,tamuno-the-prince,tamuno the prince,An Ijaw prince who is also the heir to the throne,Male,hair: covered; eyes: sky-blue; teeth: closed; clothing: akan;  accessories: cap; expression: straight-face; strength: caring; weakness: easily deceived,108447d1-f2d5-4816-8ebb-599286c3fabf,f7a6becc6c6f9a56c6ae877bf4c06a8bd3b073efa845d6387de458771b4afb2f
301,wendy-the -banker,wendy the  banker,"Wendy loves working in the bank, as she gets to meet different people.",Female,hair: dark red; eyes: blue; teeth:none; clothing: blue and yellow ankara; accessories: none; expression: shocked; strength: none; weakness: none ,587645e2-5ace-11ed-9b6a-0242ac120002,e578f0df4f68e825441e79eed45909634ad57c989d784ea9353b88148197b4f7
302,uduak-the -dark horse,uduak the dark horse,Uduak looks innocent and has the whole apartment bugged,Female,hair: brown; eyes: blue; teeth:none; clothing: multi-colored ankara; accessories: none; expression: witty; strength: none; weakness: none ,58764862-5ace-11ed-9b6a-0242ac120002,9d9e8ae34b38e567e8604f61c6fd177d06b80ee3b5ec48b50ca642a1b3a0b72f
303,timeyin-the -eccentic,timeyin the eccentic,Timeyin is as eccentric as they come with no care for others opinions,Female,hair: brown; eyes: blue; teeth:none; clothing: multi-colored ankara; accessories: smoking pipe; expression: high; strength: none; weakness: none ,58764a2e-5ace-11ed-9b6a-0242ac120002,2017005ad0aee4f2fb040faeb51a6f31d98970416b2fb98914b8a1904f9d8bd7
304,omawunmi-the -businesswoman,omawunmi the businesswoman,Omawunmi is a no-nonsense woman with a shop in idumota,Female,hair: pink; eyes: blue; teeth: white teeth; clothing: yellow ankara; accessories: none; expression: angry; strength: none; weakness: none ,58764b78-5ace-11ed-9b6a-0242ac120002,ef0c958b3061c55dce984ed89f861540a852120c0fa19d77c59708de293b35ad
305,halima-the-housewife,halima the housewife,Halima loves to bake and cook for her children,Female,hair: brown; eyes: blue; teeth: none; clothing: ankara designed with yellow red and green; accessories: none; expression: tired; strength: none; weakness: none ,58764d8a-5ace-11ed-9b6a-0242ac120002,77f4ace05f76613a2d665a69e812fa6fc4bb7cdc31cf52fc44e7fa6e24534112
306,muna-the -block sister,muna the block sister,Muna loves to tell everyone in the block about her younger escapades,Female,hair: black; eyes: blue; teeth: none; clothing: wolf skin ankara; accessories: headgear; expression: shocked; strength: none; weakness: none ,58764ea2-5ace-11ed-9b6a-0242ac120002,665e68cbd6ffdbcaf9d3a9d5a094943a02b6bf9c4c6e931911c7760ddb31c38b
307,stella-the -gossip,stella the gossip,Nobody gossips on the block like stella when smoking.,Female,hair: red; eyes: covered eyes; teeth: none; clothing: black ankara with bright design; accessories: none; expression: calm; strength: none; weakness: none ,58764fd8-5ace-11ed-9b6a-0242ac120002,1bcfcfa9443b44218f3b53647cdf00b4940973e165218b075b4cfea15ba82a6f
308,agbani-the-wannabe,agbani the wannabe,Agbani loves to shop antique decorations for her mansion in Idi-Iroko.,Female,hair: purple hair; eyes: covered eyes; teeth: none; clothing: blue one-armed dress; accessories: none; expression: happy; strength: none; weakness: none ,5876542e-5ace-11ed-9b6a-0242ac120002,822ccb16c3062afb04de0e28ce1100d9770d4fa6ed77ad8b1f29b4a6da22400a
309,asante-the -warrior,asante the warrior,Asante came from a long line of warriors in Ghana.,Female,hair: pink braids; eyes: covered eyes; teeth: none; clothing: one-armed brightly colored dress; accessories: none; expression: calm; strength: none; weakness: none ,58765578-5ace-11ed-9b6a-0242ac120002,92cd3e067810f3d770dd19845dd768b9ac11e1fa1991c7e83cb42cb3abd9529b
310,hilda-the -insomaniac,hilda the insomaniac,Hilda prefers to sleep during the day.,Female,hair: pink; eyes: covered eyes; teeth: none; clothing: multi colored ankara; accessories: none; expression:calm; strength: none; weakness: none,5876569a-5ace-11ed-9b6a-0242ac120002,5191759c1d67b2a9f4650b6d29191abbef54a02d300834927cffbf2633736fd5
311,sisi yemi-the -street aunty,sisi yemi the street aunty,Sisi Yemi is everyone's favourite street aunty.,Female,hair: dark brown; eyes: brown eyes; teeth: none; clothing: blue and yellow ankara; accessories: none; expression: shocked; strength: none; weakness: none ,587657a8-5ace-11ed-9b6a-0242ac120002,1d438afabaa53cba42fe6d8d21480b9ac2870947b84a707b7acb7915371be9a4
312,chiamaka-the -bully,chiamaka the bully,Chiamaka hates people in her business and likes to scare the kids on the block.,Female,hair: pink; eyes: brown; teeth: none; clothing: multi-colored ankara; accessories: smoking pipe; expression: strong; strength: none; weakness: none ,587658ca-5ace-11ed-9b6a-0242ac120002,faab9b9675e168d6f026522dddaa72c263fa3b5320c468492d495a216f54a856
313,gift-the-fashionista,gift the fashionista,Gift has always been bold and that spreads to her fashion sense too.,Female,hair: brown; eyes: brown; teeth :none; clothing: multi-colored ankara; accessories: none; expression: witty; strength: none; weakness: none ,58765adc-5ace-11ed-9b6a-0242ac120002,e5e2533226754f90239fd0708810bc6f3b82dd7bc94583a5cc0bb80527f608ba
314,omoyene-the-weirdo,omoyene the weirdo,Omoyene likes to murmur to herself and talks about seeing ghosts.,Female,hair: brown; eyes: brown; teeth: none; clothing: yellow ankara; accessories: none; expression: calm; strength: none; weakness: none ,58765bea-5ace-11ed-9b6a-0242ac120002,7ac67b7d4dc4b825364b2bf3459de41f555a66a81969cfe43e7b50064e1c33f1
315,maria-the -freshface,maria the freshface,Maria likes to believe the world is sunshine and rainbows while blowing gum.,Female,hair: pink; eyes: brown eyes; teeth: white teeth; clothing: yellow green and red ankara; accessories: none; expression: furious; strength: none; weakness: none ,58765d02-5ace-11ed-9b6a-0242ac120002,2edfc9e6afdb4342fe7137de50382d83b1658a872af95dec31606737070542c5
316,monica-the -smoker,monica the smoker,Monica is never found without a pipe and loves to interject in every conversation.,Female,hair: grey; eyes: covered eyes; teeth: none; clothing: black ankara with bright designs; accessories: yellow glasses; expression: hip; strength: none; weakness: none ,58765e24-5ace-11ed-9b6a-0242ac120002,fe4d0c905ac56e950270c5d6c7fbae7b0e561db535ede1aa30761f40a173573b
317,janet -is always -found singing ,janet the singer,Janet is always found singing in whatever activity shes doing.,Female,hair: purple; eyes: covered eyes; teeth: none; clothing: yellow and blue ankara; accessories: yellow glasses; expression: cool; strength: none; weakness: none ,cef902bc-5afc-11ed-9b6a-0242ac120002,682bb9b7206c741b4d1cc6e621208710310aaf734c5e803513109197395126de
318,emi-the-reggae-girl,emi the reggae girl,EMi is a beautiful dancer; she rules the reggae world.,Female,hair:pink braids; eyes: covered eyes; teeth: none; clothing: multicolored ankara; accessories: yellow glasses; expression: happy; strength: none; weakness: none ,cef9060e-5afc-11ed-9b6a-0242ac120002,52833df87b9e9948e63261f725f6301ca3ac96e1058ee72b2df165d915b3e2e0
319,aisha-love-the-life-of-the-party,aisha love the life of the party,Aisha always party during the weekend.,Female,hair: red; eyes: covered eyes; teeth: none; clothing: wolf skin ankara; accessories: yellow glasses; expression: hip; strength: none; weakness: none ,cef907a8-5afc-11ed-9b6a-0242ac120002,2d9e21b220487672b0cdb2af6046d9edb53af9983c2af984baa47d10994841ec
320,amaka-the-tailor,amaka the tailor,She sews the most beautiful dress in the hood.,Female,hair:grey; eyes: covered eyes; teeth: none; clothing: black dress; accessories: yellow glasses; expression: happy; strength: none; weakness: none ,cef9091a-5afc-11ed-9b6a-0242ac120002,82ef4c1648fa3f01379a87f06164f5d5d0f6a457696fbade0dd31697cfcc8cba
321,omunyinyi-the-stoic,omunyinyi the stoic,Omunyinyi wears a Kitenge coat.,Male,hair: bald; eyes: teary; teeth: none; clothing: checked ankara; accessories: none; expression: teary; strength: powerful; weakness: self-loathing,c2d6a3ac-1d4d-4268-ba7f-4f0f8f50c1ab,13894bf4918fad9ad74e3a5bb3808d822a3bf37fcab935b907de8bed7d2eb6ea
322,kamau-the-sleeper,kamau the sleeper,Kamau has his eyes closed as he meditates.,Male,hair: blad; eyes: closed; teeth:  none;  clothing: black ankara; accessories: none; expression: flat; strength: open to suggestion; weakness: always sleepy,20330f5c-40c2-4f6a-b9d8-d1d04fb97daf,5e384e563b2c02355825c237c1323e97228ed860d98b04209f49eb412d641d8a
323,mutiso-the-lastborn,mutiso the lastborn,Mutiso is masked up but dozes off while waiting for food. ,Male,hair:bald; eyes: closed; teeth: none;  clothing: yellow ankara; accessories: none;  expression: tired; strength: consistency; weakness: pessismist,0706c338-42eb-4d26-84ea-c24b39628200,7c7e654bcd17f46a7cb06c4061a6e4bc860f1343474f006a013f0f3fdab85e9e
324,omondi-the-vegeterian,omondi the vegeterian,Omondi wears a green coat with lots of patterns. ,Male,hair:bald; eyes: sharp eyed; teeth: none;  clothing: green ankara; accessories: none; expression: alert strength: leader weakness: anxious,bfb5e8d5-d7a7-4aa8-85e8-d7d9afd4adb3,cea4b792f864195175190b05fcdf952a2d2e181551a7c2a0dc2781e8b39c4904
325,barasa-the-optimist,barasa the optimist,Barasa looks up to the sky and makes a wish.,Male,hair: bald; eyes: blue teeth: none skin: dark skin clothing: brown ankara accessories:none expression: awake strength: strong willed weakness: immoral,2da4bef4-38cc-4414-99ad-7361fac04b2b,8ae173c10d8237c6932a838bd573eda75ab32571f79866eb4c53d282e2093c2e
326,mwembu-the-elder,mwembu the elder,Mwembu is old but not so old and yellow is his favorite color.,Male,hair: bald; eyes: black teeth: none skin: dark skin clothing: dark ankara accessories: none  expression: plain strength: fulfilled weakness: angry,36181230-6ac9-417f-af5c-23bdd2c25ecb,0d46e4a8d6102a9b4b86246c8e528dc07629e969a081052e34bcb317db35089e
327,mbogi-the-fighter,mbogi the fighter,Mbogi is captured and forced to wear a mask. ,Male,hair: bald;eyes:  blackteeth: noneskin: darkskin clothing: onesideankara accessories: noneexpression: willfull strength: fighter  weakness: rebellious,3a7bc3c4-1463-42ce-84c9-07337da64435,e3aeba572c7fc13dacc1897bf6e4266819e3b153f4f97e054eae279492631700
328,mrosho-the-runner,mrosho the runner,Mrosho has his mask on and yet still runs his race. ,Male,hair: bald; eyes: sea blue teeth: none skin: darkskin clothing: purple ankara accessories: none expression: alert  strength: visionary  weakness: destructive,b2ca2c76-3b6d-43f1-8cc9-089b6ab83876,4979627b1cbc7c9d07f8332bae42afe4f307c73e08f18cee9c176336894662c7
329,milele-the-african,milele the african,Milele wears a dress with a nice african print in orange.,Male,hair: bald; eyes: blue teeth: none skin: dark skin clothing: orange ankara accessories: none expression: timid strength: leader weakness: failure,644b0259-d75c-456d-934c-ce7c052bad3a,f3384039f631189443ad438d2423bd84bc93804efe8b047f8a7cc2c48012992d
330,olebon-the-oloibon,olebon the oloibon,Olebon is in a customized buba sokoto.,Male,hair: bald; eyes: closed teeth: none skin: darkskin clothing: animal print accessories: none expression: surprised strength: empathy   weakness: easily bored,de261efe-731d-461e-b2e4-42edd2f48f72,214a067c538e3be3a012aec190259e1142f42f75be9bfd871f9476ee2e458c6d
331,chifu-the-maasai,chifu the maasai,Maasai shuka keeps bringing inspiration for new clothings. ,Male,hair: bald; eyes: closed teeth: none skin: none clothing: ankara shirt accessories: none expression: visionary strength:  authentic weakness: selfish,239933c4-7177-4b5b-86e8-e6f952301344,6ee33e40e7cb671b7c6a901754044b599ff4c793935e59d8739e0139f43400cb
332,mwangaa-the-voice,mwangaa the voice,Mwangaa the chief is controlling but still loved as he has a calming voice.,Male,hair:  bald; eyes: blue teeth: none skin: darkskin clothing: white lined ankara accessories: none expression: kindness strength:  brave weakness: impatient,49179b62-812d-4d0f-b518-4af7fa79f8bc,15f6593718e2e934e8f12a6550fd3119c655f7150db3641a13bd22c51165d9c1
333,waforte-the-first,waforte the first,Waforte loves to sleep and does nothing else.,Male,hair: bald; eyes: closedteeth:none skin: darkskin clothing: jean ankara accessories: none expression: shy strength:  weakness: selfish,871912a8-d96e-4594-b7b3-450d94ee6924,463010da01858d0c12c8cf74c4b2247c87cd5a49864359f53089fb3d0c94c300
334,kariuki-the-prayerful-one,kariuki the prayerful one,Kariuki closes his eyes as he watches the sunset.,Male,hair: bald; eyes: closed eyes teeth: skin: clothing: accessories: expression: bored strength: intelligent  weakness: passive,6a5b6fa6-0f91-4b01-957f-c766945eb704,c42d9447ef29f9880c077c1ec554cbcadfd97b23c540f7e575e2d1bff278f411
335,kenyanese-the-priest,kenyanese the priest,Kenyaanese is a masked up man with a white cloth as his signature attire. ,Male,hair: bald; eyes: white teeth: none skin: darkskin clothing: white jean shirt accessories: none expression: calculative strength: kind weakness: takes things personally,0706c338-42eb-4d26-84ea-c24b39628200,0ec0a2a979d1785c7e590ab409f670f85e1c9b4d5097f8e2127b60fd6e9200b0
336,nyimbo-the-singer,nyimbo the singer,Nimbo has his glasses on and a pot with hot porridge for the night,Female,hair:dreadlocks; eyes: glassed up teeth:none skin: brownskin clothing: off shoulder ankara accessories: a pot expression: free spirited strength: fair weakness: impatient,d05af807-b3e9-4ad3-8df1-b7864d2daa33,25a15766a170d15257c27ecdb0f9a62771b6e98b1e4ce251be222b157f6a6553
337,maathai-the-nobel-winner,maathai the nobel winner,Mathaai the warrior is revered all over the land. ,Female,hair: pink afro; eyes: glassed up teeth: none skin: brownskin clothing: colored ankara accessories: noneexpression: strict strength: leadership  weakness:short sighted,0871cb8c-8d56-445d-92c7-01793f327707,9d6991c37ced05c00b5c4f98585fc6439cf22f62fa86c38d4ab1c94597e7469f
338,tish-the-angry-one,tish the angry one,Tish is always angry and with specs on he looks really mean. ,Female,hair: black huge afro; eyes:  none teeth: broken teeth skin: brownskin clothing: offshoulder ankara accessories: none expression: disgusted strength: blunt weakness:greedy,750a89dc-44ff-43bf-8211-b7776f1b5e52,b1734462f2dda99f668c843ab63a2027885df4e5e2a47c21dbd6ecd1740e41ed
339,wamenza-the-winner,wamenza the winner,Wamenza the leader has led his team to yet another thrillig victory. ,Female,hair: laid back; eyes: none teeth: none skin: brownskin clothing: offshoulder ankara accessories: noneexpression: meditative strength: strict weakness: impulsive,7348c9ed-4ac9-4785-9434-0a1f0dcaf8d8,1fc4bd1501be6f06a753feb2b7230e58ffb41ba726a548087ee2b18020fbde9c
340,isaya-the-track-king,isaya the track king,Isaya the traveller has done a lot of travelling round Africa. ,Male,hair: none eyes: glassed up teeth: none skin: brown skin clothing: bright ankara accessories: none expression: taken aback strength: straight forward weakness: selfish,41781a16-d2b8-4fc6-a1f4-b9fffc5c95ba,a30a62a6e0347b586fb7b73db8d53798404329e395acfb20b376847a161d0fba
341,mansur-the-partyrider,mansur the partyrider,Mansur is the life of a party and never caught dulling.,Male,hair: none; eyes: ash grey; teeth: none;  clothing: agbda; accessories: studs; expression:happy; strength: intelligent; weakness: red whine,78db0f29-3936-4d9c-bb90-3dbf20dba2dd,842e0be26c3b4c40cfa848d8758b70d888148c7a0129e983746f02496b5ca0ff
342,tola-the-businessman,tola the businessman,Tola loves business and owns several shops in Idumota.,Female,hair: none; eyes: midnightblack; teeth: none;  clothing: purple blowse; accessories: mask; expression:furious; strength: powerful; weakness: love,1c5d5a6b-cf04-4bf9-978e-22a7e9bc5819,2641d1767608113d7a90293f86d716e92e65e58286805dda78c89cd89879346f
343,abdullahi-the-honorable,abdullahi the honorable,"Popularly called ""buje budanu"" a godfather who lavishes money on young gees.",Male,hair: none; eyes: blue-blackish; teeth: none;  clothing: yoruba attire; accessories: none; expression:anxious; strength: foreseer; weakness:indecision,dd708276-445f-4483-8357-fc08e999328f,a0cb2d3bf585daa1c0cddd9aa1fed71ce6a14fad789835d81ae82fee0ef806b7
344,ojukwu-the-badguy,ojukwu the badguy,Ojukwu is a business minded guy but fun to be with.,Male,hair: bald; eyes: eagle eyeball; teeth: none;  clothing: yellow lining blowse; accessories: none; expression: none; strength: good eyes for fashion; weakness: lack will power,76c1eabf-15ea-446a-8426-472982c4d800,24306e74ce30792f11dd55649a8b3ce41f66fc6a9cb47d642d71cad3228d8bb0
345,odunsi-the-egbonadugbo,odunsi the egbonadugbo,Odunsi loves to advise and people in the community rely on him.,Male,hair: none; eyes: dark brown; teeth: none; clothing: one shoulder gown; accessories: none; expression: none; strength: elegant; weakness: easily depressed,2912ab8b-5875-4277-a5c2-a0209aee90ae,8966d2951d8bdca11ba8b1005d44935dfe053731f8f322156f34c383422b1fde
346,ogogo-the-sugardaddy,ogogo the sugardaddy,A rich oil magnate who loves to solve young women's problems with his millions.,Male,hair: none; eyes: cat eyes; teeth: none; clothing: purple danshiki; accessories:nose mask; expression: straight face; strength: brave ; weakness: too selfless,aa575f30-04ad-45f9-a798-199465117793,db398a8d8fd455a697bf30906de6829ea7e1a45a2ca9559ca62de16a045da537
347,suli-the-amalaseller,suli the amalaseller,Suli sells amala with respect and people say that's the secret to her sweet food.,Female,hair: low punk; eyes: cat eyes; teeth: none; clothing:brown babarigai; accessories:none; expression: furious; strength: wealthy; weakness: too emotional,46fd4821-04dd-4f65-9290-c130a00c4c93,e28987dc4c58cbf6223957edd71892eda6e1058f715ba3a38d50a6d4e9432da8
348,dolapo-the-afrocentric,dolapo the afrocentric,Dolapo loves African prints and loves to showcase culture.,Female,hair:bald; eyes: brown; teeth: none; clothing: one sided blowse; accessories: nose mask; expression: none; strength: beautiful; weakness: forgetful,cbab232b-5c62-4df8-867b-018a2e496cd4,0094b375ba9df34ba8a5a7dad08eb2d17b298f09ac1fd29af8b89200e15731d7
349,danjuma-the-saddist,danjuma-the-saddist,Danjuma is a grumpy man no one likes to associate with him.,Male,hair: none; eyes: sky blue; teeth: none; clothing:purple agbada; accessories: neck beads; expression: excited; strength: outspoken; weakness: boring,5a42af57-186e-425b-b6b1-f72bda4911ef,a7f0f99d9bcf5ef958c275b45894f145a746733a8facb37047df997057e2b96c
350,chinedu-the-farmer,chinedu the farmer,A hardworking farmer who has 6 boys who help out on the farm.,Male,hair: none; eyes: black; teeth: brown; clothing: one sided gown; accessories: none; expression: blushy; strength: easily loved; weakness: get angry easily,9e8a55d7-0d8d-465d-a628-08ddd387a2c6,3904f96e651cc2b7fdd8559c5c0b708eddfc5a0d1f9ba947a5bb2344fda6cdd1
351,kola-the-baldguy,kola the baldguy,Kola is every girls dream man because of his hair style.,Male,hair: low cut; eyes: mouse eyes; teeth: none; clothing: gbariye style; accessories: nose mask; expression: unhappy; strength: good eyes for details; weakness: sluggish,c32f1757-da9c-49e8-bd79-510a42b6971a,e50314bceb751f47ef7921ccb574106b8039bc134c98c77727228e4684753e68
352,bola-the-bosslady,bola the bosslady,A lady who supports the boy child by providing scholarship to young talented males.,Female,hair: low cut; eyes: brown; teeth: none; clothing: short orange gown; accessories: nose mask; expression: none; strength: industrious; weaknes:spend lavishly,09ff910d-a2be-49d5-8b27-b9378458701c,4e51333a4b4aaaafff596a29bc41a7b7e68dc5c7ac1ff17f1ceba036648109cd
353,kunle-the-alienguy,kunle the alienguy,Kunle is special and easily get noticed even in the midst of crowd.,Male,hair: green punk; eyes: green; teeth: none; clothing: purple agbada; accessories: purple beads; expression: unbothered; strength: very energetic; weaknes:eaaily give in,dea2f5d8-e3ba-4d3f-9a17-0a7edfd0c100,50802a17b766a9322255d33b0b76d40884dd45e7f2136b1b1ae006144f70ca70
354,segun-the-sharp,segun the sharp,Segun drives with caution and people love him for that.,Male,hair: green punk; eyes: black ; teeth: none; clothing: orange buba; accessories: nose mask; expression: bitchy; strength: team player; weaknes: none,f9159a9c-f48d-4aee-bcc1-63c86209f806,4f36cd9031485c94646b50683af5824e6a1b86a1ee05a40bf82a6c2233400001
355,ola-the-hardguy,ola the hardguy,Ola may be feared but he is such a coolheaded champ.,Male,hair: none; eyes: closed eyes; teeth: none; clothing: purple buba; accessories: none; expression: sick; strength: quick recovery power; weaknes: get ill frequently,a814fc77-bdfa-4e50-8ba8-3e4e4bcfb3c0,9700a40069ee6c6f075169503a5959ab5050cd2c1716aab0d2945924827a5e94
356,emeka-the-chief,emeka the chief,Crowd are always at Emeka's house because of his selflessness.,Male,hair: none; eyes: closed eyes; teeth: none; clothing: pakaja attire; accessories: none; expression: bossing; strength: easily comman respect; weaknes: not a ladies man,195e89c8-0b6f-43ad-9a2c-d20f03439e96,91e0de4563241f4c08111ec00204f4ceb670714368851c9b011d86d8b2472324
357,ugochukwu-the-celeb,ugochukwu the celeb,Ugochukwu is an online celebrity with many followers on social media.,Male,hair: white blode; eyes: closed eyes; teeth: closed teeth; clothing: black gown; accessories: gold shades; expression: bitchy; strength: enterprising; weaknes: too emotional,74775cda-cff4-4d21-8819-693127598eca,fb4f2dd91c842c5dc68d7b21bcf2aca9e3d8a4be7dd97db4c5e20c4584a1e667
358,adekunle-the-yorubademon,adekunle the yoruba demon,He might be every woman's man but faithful and loyal to one.,Male,hair: gobi cap; eyes: closed eyes; teeth: closed teeth; clothing: ghana dansiki; accessories: gold shades; expression: owanbe mood; strength: from a walthy home; weaknes: disrespectful,5c98c2d8-3144-4e08-8a0f-9b8d7e4f5aa7,a6539ed4c31a62ec1b61cd4f072c3aa4b790fc04f12fb2940126d950cf54e070
359,favour-the-fashionista,favour the fashionista,Combining dresses is not a problem for Favour.,Female,hair: black ghana weaving; eyes: cat eyes; teeth: none; clothing: senegalese blowse; accessories: gold shades; expression: party rider; strength: smart; weaknes: lazy,19fc15c3-80fe-4d45-a2fe-be8f087d57c4,2363940d4adcc1d7566ef3daec0815c8c4ec3be613871dee6d9e75d8f99c303b
360,jane-the-slayqueen,jane the slayqueen,Jane is always found in the midst of men and loves partying.,Female,hair: long grey braids; eyes: closed; teeth: black lips; clothing: black short gown; accessories: gold shades; expression: happy; strength:very intelligent; weaknes: have mood swings easily,74775cda-cff4-4d21-8819-693127598eca,552b594cc7ead210b987d73d924332e953e3dc14a9cef53658d4c681f5f5c062
361,osas-the-ceo,osas the ceo,Meet Osas; a Gen-Z CEO with the British accent.,Female,hair: purple dreadlocks;  eyes: none; teeth: none; clothing: danshiki;  accessories: gold glasses; expression: none; strength: none; weakness: none,b10f7e42-4778-49db-820b-dabbad75504a,c53eaf37f24241aecc774d90a558cf7233b32abe656e0e05e5e03b83a42bf569
362,nneka-the-rainbow babe,nneka the rainbow babe,Nneka; the happy rainbow babe with the vibes.,Female,hair: pink;  eyes: none; teeth: none; clothing: blue and black bichrome; accessories: gold glasses; expression: none; strength: none; weakness: none,e7e20ab8-03e0-4e0a-80aa-6e193f84426e,f617eaaffb160ac4bbe007f86286d433d63f5aa5972ef319022ac62c5ef752c1
363,temitope-the-spoilt girl,temitope the spoilt girl,Temitope; our favourite daddy's girl.,Female,hair: none; eyes: none; teeth: vampire teeth; clothing: right one-shoulder wax print; accessories: gold glasses; expression: none; strength: none; weakness: none,10cbcbcb-754e-4175-b85d-d0c7eafa16a2,25025b1a2ccbee41e08efb10ac9243853f9a3029f5b0f91158c61ac31bf3e931
364,bekeh-the-party animal,bekeh the party animal,Baby Bekeh is life of the party that goes home with your charger.,Female,hair: dark brown;  eyes: none; teeth: none; clothing: left one-shoulder wax print; accessories: gold glasses; expression: none; strength: none; weakness: none,f0558235-3043-46e5-b26c-5bde83cc67fb,21964fc8837444048f47c0d1a56fd01ba95872360a34a202a98ce7aeb1156f55
365,nana-the-tech lady,nana the tech lady,Nana; the tech madam that doubles as Kumasi Adele in her bathroom every morning.,Female,hair: black; eyes: none; teeth: none; clothing: print kente;  accessories: gold glasses; expression: none; strength: none; weakness: none,e0858913-7050-4c4a-a2a0-442a88463334,eef52358df272974e4756ff417beee7f00154b608de7a11323be5dabc06b2571
366,rofiat-the-marketer,rofiat the marketer,Rofiat; the distressed marketing intern.,Female,hair: purple dreadlocks; eyes: brown; teeth: none; clothing: danshiki; accessories: none; expression: none; strength: none; weakness: none,1e4d9bda-f6f9-4e7a-9381-bee4b074b56d,effc5a2782477a8a395faa9ef3f7138038e5a5f1320551ecbb44c2b2232ade18
367,zarifa-the-righteous,zarifa the righteous,Meet Zarifa; a proper baddie for Christ.,Female,hair: pink; eyes: blue; teeth: none; clothing: v-neck original kente; accessories: none;  expression: none; strength: none; weakness: none,c6955d16-c343-46bc-9bed-c069ea8cc65a,c5ede9e504291050761e958ea4dbb95106cf644cf6f263dab3742cb507e91415
368,modinat-the-troublesome,modinat the troublesome,Modinat; The queen of gbas gbos.,Female,hair: long maroon hair; eye: none; teeth: vampire teeth; clothing: right one-shoulder wax print; accessories: brown glasses; expression: none; strength: none; weakness: none,49eb44e8-1117-463b-b7b3-1bcea4258362,3c39b419eb1360a9a8d23949e6287664803f016c924ce2f0b3806096fd583a23
