Series Number,Filename,Name,Description,Gender,Attributes,UUID,Hash
391,Abosom,Abosom,Abosom is the goddess of wisdom and knowledge of the Ghana people.,Female,,b3427836-627b-41e4-a2d0-c29473448343,25d77c3302e09e5f74a389e5ace4adc70a638ff606feb36c1ca82a936dad0520
392,Oya,Oya,Oya is the goddess of violent storms and winds of the Yoruba people.,Female,,22aaebe4-4659-44de-ab3d-c4dae11fe9f5,b025a0ea234b74461134db60f26d2005545dd93635828ecc51150908d2724e7f
393,Agbala,Agbala,Agbala is the stylish goddess of the future for the Igbo region.,Female,,ca720bf9-5e47-4421-b38f-bc62162ae99e,4091c8ab8d8fdb53e4b3835707cc2bdb003dc4c1ea201186fb650e912eefc6de
394,Njoku-ji,Njoku-ji,Njoku-ji is the goddess of new yam of the Igbo people.,Female,,3b795bad-91b4-4d0e-8ed8-bccbb226fc55,a26e2c703b8aba12944e40ab27cc73fa6e0cb87f8b7c9d5827534fefd2a7a0a4
395,Akonadi,Akonadi,Akonadi is the goddess of justice and prophesies of the Ghana people.,Female,,2aebd094-3be5-4773-a7a0-361f6332a7d4,05b4f213f2a1da54a4343ec629722935f1de15dcf7db95c6a177369ae649bcb3
396,Onyame,Onyame,Onyame is the goddess of the moon of the ghana region,Female,,fb148f97-d309-45a4-b902-4e066ca13f96,a4a4f62c5a0065df1a1f4204a2522bf9ac7255209d500cf1ec4403238c17a21b
397,Ibeji,Ibeji,Ibeji is the goddess of balance and twin of the Yoruba people.,Female,,7b210c03-5446-462d-980e-c73dbbc1e386,9a7bb8b8e21924969f362119798cb9a9b4d9091cad0fa9e3e9bcbdebd9ce2b38
398,Asase-ya,Asase-ya,Asase-ya is the goddess of fertility and love of the Ghanaian people,Female,,80b51092-3fbc-4d0c-8518-fc461ccb6c80,8919cbda6c1138903c9ba225741446447a749dc779d826798b74ef94a43f6dfb
399,Yemoja,Yemoja,Yemoja is the stylish yoruba goddess of the rivers.,Female,,1693b44d-96cf-4c2d-89be-9f4219c28447,e8718dd59f0841fc1f3a555585d08de08d6bb3ae4ef17318daf0257824e8d28f
400,Yemaya,Yemaya,Yemaya is the Ghana goddess of rivers and waters.,Female,,9609d0f4-d9d3-4cff-aa06-a9c459fefa39,449db661a5a2b70ac2a91c5f172beae6e8afe28f1c1707b86ef093c2b82e9206
,,,,,,,83355207526f3aa4501fa67ac0878eeec53ac0391b1c1499df8b13956d0fe9c0
TEAM BOOT,,,,,,,f25c733d7af4fd4b868bbcbe2932555935d8aa4220b7c8c855ec40ebeb1f6497
401,smirky-becky,smirky becky,Becky ends every statement she makes with a smirk.,female,"Eyes: Brown, Accessories: Ankara beret",87bcc41f-eb3e-4ba2-9645-223c949a9b50,9b94fcb5f03a34a2ceacfdb8770dacd4828302cb934019d09fd6f2394845a3d3
402,ankara-scarlett,ankara scarlett,Scarlett is a tailor at yaba market and she loves what she does.,female,"Hair: Orange bun, Skin Colour: Caramel",66d0149f-5f2a-4ded-8e6b-9bd7d7631c39,4b207a241c9f4d84f04bf14f7cca22be0390f328caa79373519d9eebc363c257
403,sea-rastafaria,sea rastafaria,Ronke is the ghetto goddess that nobody wants to mess with. Stay clear!,female,"Hair: Purple dreadlocks, Skin Colour: Caramel",d1556c97-9075-49fc-8bde-1826bfc2dbe1,ce56ec92d4898b8c6c2c90afd7f64d98ed2c6e73867324fb93d8f248a131b069
404,pretty-betty,pretty betty,Betty is always proud of her beauty.,female,"Hair: Orange bob, Skin Colour: Caramel",6a4f5b7c-914d-42c5-8e5f-d1c34ca48886,fa61c21bb188be3e79ea5a0554bd4102531754d277f9244bda4c097bcc7947f2
405,lola-medusa,lola medusa,Lola knows how to seduce every guys she is into.,female,"Hair: Long red braids, Skin Colour: Caramel",32ec57f7-8272-4671-ad2d-db3dff99fe9f,eb01ae143a9671fb05c2ccde80ac6c751abfbffa740bc0fde05de664a09e1a91
406,bukola-nosend,bukola nosend,Bukola is friends with many but always get moody.,female,"Hair: Brunette bob, Skin Colour: Dark brown",59d19b13-09e2-412e-a669-df020e03ae10,f04279c1395fda66db0f8a03202386fba4fb4a2375ca9fb7a953f1704e69d996
407,burna-morgan,burna morgan,Morgan paints the town red with her red hair.,female,"Hair: Two brunette buns, Skin colour: Dark brown, Accessories: Tobacco pipe",d08af477-de20-4780-8449-46b87840b9fa,8c2f5b2717dba89b375b5e65ebd7fba468a3e3d75429e0010db0b1cd391fafeb
408,afro-star,afro star,Bimbo is an afro star with great affluence.,female,"Hair: Orange afro, Skin Colour: Caramel",40743b16-ae12-4b4a-989c-e5fbf1e2e0ca,5948604e4c0b47f6092e9767154b201a1af3e017e431c141ab57ee53b7ff883a
409,fiesty-sandra,fiesty sandra,"Sandra is a social animal, correct owambe ambassador.",female,"Hair: Brown bun, Accessories: Purple bubblegum",d875aa6c-3e4a-4450-b09c-e9f1cdcc3947,f1b259efd1a83cacdb498e008713abceb1a13030050d21949dc3492317801f5a
410,sister-nkechi-sabi,sister nkechi sabi,"Nkechi is the true definition of amebo, always in peoples business.",female,"Hair: Black low cut, Skin Colour: Brown",a728a380-1d33-4080-841d-80b041474d8f,cd22813f333b7df5393a9c50839122615b2022815ba00854a09b42d888ced62b
411,unfriendly-gina,unfriendly gina,"Gina is an angry one, she has no friends but she has a lot of money.",female,"Hair: Orange bun, Skin Colour: Caramel, Expression: Stoic",dd30a327-8a74-40a5-8207-19a790508ccc,da3c361f3c9d715c455d5f841b32a571cc3a402bd9614d15465289516b51cc77
412,dada-ganster,dada ganster,"Dada respects no one, always finds pleasure terrorising others.",female,"Hair: Purple dreadlocks, Skin Colour: Brown, Expression: Annoyed",e1a43f65-aad2-4385-ac5e-bc159c6e0f2a,2d541eb1729c31f8a73e38904c35c079a1b751f5b82f852c5b423f981ff6c916
413,idoncare-linda,idoncare linda,"Linda is a beautiful but very annoying girl, she turns every thing to a fight.",female,"Hair: Orange bob, Skin Colour: Caramel, Expression: Mischievous",ed04b47c-ae98-4db2-b71b-04d7bb976d45,4fa50ca11134b2e186202e787d0a7c280c83b336a592c77e06fbf8f874cef259
414,doubting-vivian,doubting vivian,"Vivian just like the thomas in the bible, she doubts all.",female,"Hair: Long red braids, Skin Colour: Caramel, Expression: Pissed",a0282797-44ef-4bfb-a701-e4ed5e727d63,7833a69c49d0dc276594ab7db9e80f1ea1b24fcd6a334316824e68dc599e00d3
415,simbi-side-eyed,simbi side eyed,Simbi is reserved but doesn't allow anyone intimidate her.,female,"Hair: Two orange buns, Skin Colour: Brown",1f99104c-e98b-4c9a-9891-00a481e86008,dd31f2b763b0652584c0d2c440ffd737c03d58991fc2321bed2666cbd59a2d54
416,bambi-tekno,bambi tekno,Bambi is the dancer of the team.,female,"Hair: Brown low buns, Skin Colour: Blue,  Accessories: Yellow sunglasses",95ff5e2c-1ff2-4d58-890b-de0f39f9d8ce,ee8098e2fed583ccdf961ad01d3111cce31797e97ba10ba258c8068890e8bad8
417,saka-portable,saka portable,Saka is forever convinced that his toothless smile is the icing on his cake.,male,"Skin Colour: Blue, Accessories: Purple cap and yellow sunglasses",bd98f74f-e42e-494e-8298-3183555ca666,3e65ab281bd4f4ba309e8a4d97dff0f0875a645467e5224ca311dcf0173fdf5c
418,king-of-boys,king of boys,Busayo finds her way in ruling the boys and that's why she's king of boys.,female,"Hair: Black buns, Skin color: White, Accessories: Cigarette pipe",a650e79c-f964-4eb1-aa89-f9c1dbdede76,d4a4836a41d312ae9d42716b70b5e16533b87d587e38c22ff4dd8b86f0ef761b
419,funky-alte-pop,funky alte pop,"Funke is always the life of every party, strong gen z advocate.",female,"Hair:  Two red buns, Skin color: White, Acessories Yellow sun shades, Expression: Rugged",b6753a8b-6127-4e97-812b-99e465791ba3,8c385a79c20538f79b6afb040c3e032429fc54fa86905ea114acb0e98a65d33b
420,madame-ngozi,madame ngozi,Ngozi make heads turn with her bright colours.,female,"Hair: Brown afro, Skin  color: White, Accessories: Yellow sunglasses, Expression: Pissed",7ecdbb1d-9a89-4136-b240-499051836979,dd80c40befe6ebd84d572c387f6ce0e36efae3512f84c3ec80e57f4df085ab20
